title,score,id,url,comms_num,created,body,sentiment,date,mention_count
So I bought SMCI puts this morning,3377,1fpydkt,https://www.reddit.com/gallery/1fpydkt,725,2024-09-26 20:34:38,,0.0,2024-09-26,1
"Don’t worry, this is totally normal (SMCI)",1102,1f39z6x,https://www.reddit.com/r/wallstreetbets/comments/1f39z6x/dont_worry_this_is_totally_normal_smci/,307,2024-08-28 18:48:39,"Totally normal for a company with their shit together to delay 10-K’s. Also SUPER fucking normal to announce this the day after you are publicly accused of accounting fraud 🤡 

https://finance.yahoo.com/news/super-micro-computer-inc-delay-130500753.html

Shit will really hit the fan soon when the DOJ opens an investigation into the alleged export control violations. Stock could be delisted (again) if they’re both cooking the books, AND sending high end AI GPUs to Russia and China, as the Hindenburg report alleges.",0.15,2024-08-28,1
SMCI - Class Action Suit,42,1fkjkog,https://www.reddit.com/r/wallstreetbets/comments/1fkjkog/smci_class_action_suit/,49,2024-09-19 17:56:57,"[https://www.abc27.com/business/press-releases/accesswire/917511/shareholder-alert-pomerantz-law-firm-announces-the-filing-of-a-class-action-against-super-micro-computer-inc-smci/](https://www.abc27.com/business/press-releases/accesswire/917511/shareholder-alert-pomerantz-law-firm-announces-the-filing-of-a-class-action-against-super-micro-computer-inc-smci/)

Im not a geh ber usually but this shit has to go down.

10k delayed and 12b-25 extension granted for 15 days which also expired last monday and still no news. i dont understand how this is kept so quiet. sounds like wirecard 2.0 to me.

Pomerantz Law Firm filing class action is no joke either.

I cant wrap my head around how this shithole is up 4% pre market. im getting puts now.

TLDR: SMCI got accused by hindenburg for shady business then missed their annual reporting deadline on 08/30 and filed for extension. Extension ended 09/16 and still no report. Class action suits filed. Stock was down on news in August but went up since then.. so puts.",0.1,2024-09-19,2
SMCI Received Non-Compliance Letter from Nasdaq,132,1fltylo,https://i.redd.it/4wffrk5503qd1.jpeg,75,2024-09-21 08:56:19,"SMCI has received a non-compliance letter from Nasdaq due to a delay in filing its Form 10-K for the period ending June 30, 2024. They have 60 days to file the form or submit a compliance plan, which, if accepted, could give them up to 180 days to regain compliance. The notice doesn’t affect the stock’s trading for now, but if compliance isn’t met, Nasdaq could take further action.",0.0,2024-09-21,2
"If SMCI is a fraud company, then the entire AI server market just got a lot smaller. ",301,1f3crfa,https://www.reddit.com/r/wallstreetbets/comments/1f3crfa/if_smci_is_a_fraud_company_then_the_entire_ai/,124,2024-08-28 20:44:18,"SMCI forecast 

...For the full fiscal year 2024, Super Micro (SMCI) raised its revenue guidance to $14.7B-$15.1B from a previous outlook of $14.3B-$14.7B...

I'm sure you could debate if they would claim that this is all AI server related. However, If they are inflating thier numbers by 50 to 75% that would be bad for the evaluation of the entire AI server market.  

Dell

Gemini AI:... In the first QUARTER of 2024, Dell Technologies' AI-optimized server orders increased to $2.6 billion, and shipments increased more than 100% sequentially to $1.7 billion...

HPE

Gemini AI:...While HPE (HPE) saw its total server revenue jump 18% in its fiscal second QUARTER to $3.86 billion...

Yes, I know there are other companies out there that make AI HW like Lenovo. I'm just saying that the sales that these trendy companies are receiving from AI HW specifically is about on par with what SMCI is claiming on thier reports related to AI. 

Positions : 22 calls on uvxy expiring this week. 
(When the VIX spiked to 60 in a day that really gutted my previous positions so I'm poor again) ",0.0,2024-08-28,4
Manage to grab 1DTE SMCI $400 puts at $4 when the news dropped ,439,1fpy8rn,https://i.redd.it/58dzxe3c46rd1.jpeg,61,2024-09-26 20:29:20,,0.0,2024-09-26,1
SMCI made me a millionaire aftermarket today…,5901,1ftc88e,https://i.redd.it/cy1d6e84r1sd1.jpeg,269,2024-10-01 06:52:13,,0.0,2024-10-01,1
RIP to whoever put everything in $SMCI,5886,1asark0,https://i.redd.it/caackgs3qyic1.jpeg,1422,2024-02-16 20:35:09,,0.0,2024-02-16,1
SMCI 100k YOLO RESULTS,4285,1b7bbys,https://i.redd.it/6xda5dkbyjmc1.jpeg,585,2024-03-05 23:11:02,"Thanks everyone for your support, comments and insights but here’s the results of the 100k yolo, ended up switching a few positions in the morning, took some profit, bought more and got out pretty much 100%. 

For the future, there will be more and I’ll try to post more ridiculous stuff like this but up 320k on the year, over 1/3 of the way to a million frontal the start of this month with only 3 thousand dollars. 

Thanks everyone! ",0.0,2024-03-05,1
$990 -> 42k caught puts at the very top $smci,3516,1asmwyv,https://www.reddit.com/gallery/1asmwyv,675,2024-02-17 04:54:45,,0.65,2024-02-17,0
Save my life (SMCI),2357,1asbggq,https://www.reddit.com/r/wallstreetbets/comments/1asbggq/save_my_life_smci/,1710,2024-02-16 21:04:21,"Somebody, some whale out there, please come in and give us a big green candle on SMCI. I have been playing options on this one all week. Things seemed risk-averse with the steady price movements.

&#x200B;

I am down $70K today, almost my entire portfolio is gone on 0FTD calls at $1000.

&#x200B;

Please WSB gods...please send this thing back up so I can sell and just break even or only lose $20K.

Edit: See Screenshot for current loss

Edit: I’m okay. Well I’m not okay but lesson learned. I’ll have it back in 1-2 years and keep it in long positions with good companies not in a hype cycle. 

&#x200B;

https://preview.redd.it/g9pfol1syyic1.png?width=1126&format=png&auto=webp&s=dde706fe93d971a954695dabd57e7d30537d4e91",0.0,2024-02-16,2
SMCI 100k Put YOLO,2422,1b6ox5q,https://www.reddit.com/gallery/1b6ox5q,640,2024-03-05 04:24:56,"Still very much so holding, took a 17k profit in the beginning and added it to the rest of the puts for 30 1000 strike puts with an Average of 22. Down a bit currently but doing well! Was asked by the wife to remove the original post because she’s very sensitive but fuck that shit I post again!",0.0,2024-03-05,1
SMCI Just Bought Me a Car,2008,1aqpdyj,https://www.reddit.com/gallery/1aqpdyj,489,2024-02-14 20:51:56,"Been taking the bus to work for the last year basically. Had multiple opportunities to sell and make $8,000+ in the past and then got burned. I learned my lesson. I sold my position.

Bought 3 $1080C 02/23 SMCI on Monday at $2.50 a contract. Sold 5 minutes ago at $20.00 a contract.",0.0,2024-02-14,2
"I've installed, used and tested almost every major AI hardware and SMCI has no AI tech.",1501,1athgb6,https://www.reddit.com/r/wallstreetbets/comments/1athgb6/ive_installed_used_and_tested_almost_every_major/,353,2024-02-18 06:24:25,"I've been in this field a long time with boots on ground actually handling and testing the hardware.  

5+ years ago I said AMD at $1.80 would be the best datacenter play

https://np.reddit.com/r/AMD_Stock/comments/9v1n6f/amazon_web_services_aws_pricing_amd_vs_intel/e994dka/ 

2 years ago when NVDA was under $300 I said they really have no peer in this space. I said it will probably triple in a 2 years even at it's inflated price.
  
https://np.reddit.com/r/wallstreetbets/comments/qw9glx/im_surprised_there_isnt_more_nvda_talk_before/

I've been using SMCI hardware for 15+ years.  It's cheaper, than HP, Dell Cisco, Lenovo and that's about it, it doesn't have any technical advantage.  Their support, and IPMI is sub par, quality can be hit or miss.  I've used them on off, depending on budgets.  

I've been in datacenters in Asia seen the same no name hardware with the same design as Super micro, the power supplies, air shrouds, everything was interchangeable and fit.  I could probably slide in a blade from these cheap no name server into their blade chassis and it'd all run fine. There's nothing inherently special or AI about SMCI hardware.

I don't watch Cramer but I have to assume him or some network, bank is saying SMCI is some get rich AI play.  It's got a catchy AI buzz name but that's it.  

I wish more infrastructure, sysadmins would've said more about this.  I only post this now because yes I had dinner with my relatives and someone asked me about SMCI because I worked in the field.",0.0625,2024-02-18,5
$SMCI Earnings ,620,1elt2kr,https://i.redd.it/t70mm7w6y3hd1.jpeg,463,2024-08-07 02:29:57,,0.0,2024-08-07,1
Good morning to $SMCI only,792,1arhnz5,https://i.redd.it/ibs8tngsmric1.jpeg,370,2024-02-15 20:44:07,,0.35,2024-02-15,1
"Last May, my mother moved her RIRA to Etrade and gave me the password. I sold options to WSB and bought TSLA, SMCI, and NVDA.",832,1e4s9kh,https://www.reddit.com/r/wallstreetbets/comments/1e4s9kh/last_may_my_mother_moved_her_rira_to_etrade_and/,165,2024-07-16 21:28:10,"https://preview.redd.it/e8mglluukwcd1.png?width=1186&format=png&auto=webp&s=5d1f239d5262a6357ce873e1a203e56afee244de

hoping this means i dont have to move out of the spare room because literally nobody wants to hire me after i got fired from my last job.

edit: on a serious note and jokes aside, it feels incredible to give back after my father passed and things went a bit sideways for her. she has a very big pillow to fall back on now so no fear for retirement and such.",0.0,2024-07-16,1
Did the guy who sent 100k on smci puts today delete his post?,963,1b6lis1,https://www.reddit.com/r/wallstreetbets/comments/1b6lis1/did_the_guy_who_sent_100k_on_smci_puts_today/,161,2024-03-05 02:09:42,I needed something to jerk off for a few days,0.0,2024-03-05,0
"SMCI 1100 Call, should I cut my losses at market open or hold, hoping for an increase in stock price",278,1auw3mu,https://i.redd.it/9j35yrirfljc1.jpeg,432,2024-02-20 00:58:10,"I made the stupid mistake of buying 5x SMCI 1100 calls when the stock was halfway through its plummet on Friday thinking it was about to go back up to around $950 (bought when the stock price was around $900). Should I cut my losses and sell at market open tomorrow or hold on, hoping the stock price will regain some of its lost value in the coming days? Expiration date is 03/15, IV = 127.65%, and Delta = 0.2228.",0.0,2024-02-20,2
SMCI Volatility 3k-> .25 million in a month,618,1b3a1we,https://www.reddit.com/gallery/1b3a1we,145,2024-03-01 01:44:04,"Bought 75 calls on SMCI on FEB 2/28 yolo for good PCE results on 2/29, ended up working and recovered my intial weekly loses and am up 73k this week and 250k overall.",0.0,2024-03-01,2
SMCI Put 10 bagger,693,1asar0w,https://www.reddit.com/gallery/1asar0w,105,2024-02-16 20:34:35,It's all about getting lucky and timing it right. Bought SMCI at the top and sold when it was down 6%.,0.0,2024-02-16,2
$SMCI puts $25k gain overnight. TY in Hindenburg ,524,1f3m7p5,https://i.redd.it/dw5jt6e5chld1.jpeg,61,2024-08-29 03:47:53,Bought yesterday. Sold all 10 contracts for $26.50,0.0,2024-08-29,1
Fuck SMCI,246,1dkh5vx,https://i.redd.it/z7hnkr2cgr7d1.jpeg,136,2024-06-20 22:51:17,,-0.4,2024-06-20,1
SMCI,354,1ar1f3x,https://www.reddit.com/gallery/1ar1f3x,162,2024-02-15 05:11:29,"My last post was when SMCI was @ 550 and now look where we are. I am holding of on posting my Robinhood account balance and all the options I’ve purchased because I could be sharing it daily (as you’re seeing peoples gains left and right) 
 but when it hits my PT and I sell then you will all see what I’ve personally think may be the biggest gain posted here although I did see a guy with 32 million once. I believe in AI and I really like this stock. I know a lot about this ticker and I can’t wait to show my options as they near expiry a little further into the year. Obviously the weeklies and paying off nicely but I bought my leaps when they are drastically cheaper and yes I am holding",0.0,2024-02-15,2
hindenberg short report - smci,114,1f2gxta,https://hindenburgresearch.com/smci/,111,2024-08-27 18:52:04,,0.0,2024-08-27,0
"Thank you NVDA + SMCI! $3.5k -> $35.5k, my first 10x",681,1aur0tw,https://www.reddit.com/r/wallstreetbets/comments/1aur0tw/thank_you_nvda_smci_35k_355k_my_first_10x/,68,2024-02-19 21:41:46,"&#x200B;

https://preview.redd.it/91n45w9xgkjc1.png?width=628&format=png&auto=webp&s=2b03e2c68669177beb820e10335068d41424d6af

https://preview.redd.it/n0q5u4pxgkjc1.png?width=646&format=png&auto=webp&s=06b2c71fde81f38704f03280878dc75fbfae7c67

https://preview.redd.it/fyymd9xxgkjc1.png?width=628&format=png&auto=webp&s=12b9eeca252d1e029a1c49f9498286b3e8e72df7

https://preview.redd.it/1bgrex4ygkjc1.png?width=627&format=png&auto=webp&s=d7ad828dfb6619a2bd53030492d062b464c94aa7

&#x200B;

Bought 1 call option for NVDA (2/16 625) and 1 call option for SMCI (2/23 750) a bit early during the hype. Saw a few prominent people on WSB Discord talk about them so I figured why not (not a yolo, represented a small portion of my portfolio). Managed to hold them to 10x the gains and then finally took profit.

Thank you WSB!",0.25,2024-02-19,2
$SMCI will bend me over on Monday 😂,183,1b4aqmx,https://i.redd.it/68b4mo83htlc1.jpeg,172,2024-03-02 06:08:07,Decided to buy my first Put and ofc in a timely fashion i get screwed. I’m about to lose a lot of money when the market opens on Monday😂,0.0,2024-03-02,1
What the actual F,5672,1ar3trg,https://i.redd.it/qywr20b8knic1.jpeg,1742,2024-02-15 07:02:38,,0.0,2024-02-15,0
36k in SMCI LOTTO,125,1elx2qp,https://i.redd.it/9mj0z8e8s4hd1.jpeg,106,2024-08-07 05:18:21,I live in a different time zone so don't rant about that. Although the position was in a drawdown till EOD I didn't closed as i knew after earnings it will tank down now Post Market It is 538 and monday low was 530.37 i fear off a bounce back but what the hell i am going to make money.,0.0,2024-08-07,1
SMCI set to join S&P 500,362,1b47pv2,https://i.redd.it/9whdq1snuslc1.png,96,2024-03-02 04:02:41,,0.0,2024-03-02,1
I am few of those who lost on Nvidia and Smci,234,1bt5536,https://i.redd.it/57829lkgovrc1.jpeg,114,2024-04-01 19:57:49,My tax statement will have a big number of trades but they will not be able to charge me any tax on it .  ,-0.2,2024-04-01,0
Dude… I’m getting a lambo (20k > 315k) in a month,5459,1b3xx4x,https://www.reddit.com/gallery/1b3xx4x,885,2024-03-01 21:36:06,"Big day today, DELL YOLO was a home run. In true regard fashion, I am diamond handing my calls through next week in case it goes another 20-30% like ARM or SMCI.

Check my post history for previous plays… ARM -> COIN -> NVDA/QQQ -> DELL

And before you tell me to stop being a regard and put my shit into some safe stocks or whatever… this amount doesn’t materially change my life. Now if I run this into a 7 figure account, then maybe it’s a different story. So yea, I’m gonna keep going FULL REGARD. 🫡",0.0,2024-03-01,1
SMCI is down about 60% since it was added to the Snp 500,225,1emkc72,https://i.redd.it/6f7148nciahd1.png,67,2024-08-08 00:34:09,,-0.15555555555555559,2024-08-08,1
Finally hit and held an SMCI move ,286,1fpzwec,https://i.redd.it/i1e5bq4lg6rd1.jpeg,42,2024-09-26 21:37:58,Sold one at $1500 when I finally opened the app about an hour ago. Holding 1. ,0.0,2024-09-26,1
Huge gain from SMCI,550,1asewot,https://www.reddit.com/gallery/1asewot,64,2024-02-16 23:22:53,Well boys and girls I posted in the moves for Feb 16th chat saying ours were going to pay big. Started this morning down nearly 30k with 5k left and rode it all the way to 73k and up 105k YTD in two weeks,0.4000000000000001,2024-02-16,1
$SMCI $495 -> $7000+,336,1agk84u,https://www.reddit.com/gallery/1agk84u,89,2024-02-02 01:36:56,"Bought $SMCI $600 2/2 Calls after JPOW robbed me of almost $4000 yesterday. Made it back and more. 

Keep buying regards because I only have one contract left. Now that I’m majority out this thing can moonshot another 15%

Time to gamble on AMZN earnings, wish me luck",0.0,2024-02-02,2
was bullish yesterday on SMCI but i inversed myself today,540,1asalat,https://i.redd.it/cekuq6twoyic1.jpeg,56,2024-02-16 20:28:28,,0.0,2024-02-16,1
2 NVDA & SMCI Presentations next week 👀 Stock split announcements coming soon?,229,1b4g7kh,https://i.redd.it/nmv1oku5tulc1.png,94,2024-03-02 10:38:21,,0.0,2024-03-02,1
SMCI PLS CRASH MORE,91,1asghjx,https://i.redd.it/5izreo8kvzic1.jpeg,147,2024-02-17 00:27:32,"one hour and a half before i lose half my account… need smci to crash, yall think it’s happening ?",0.5,2024-02-17,1
My balls are shaking as NVDA SMCI ARM are bring me to the moon,260,1ar34w1,https://www.reddit.com/gallery/1ar34w1,87,2024-02-15 06:29:18,,0.0,2024-02-15,1
"Warren Buffet bought a huge chunk of a ""Mystery Stock' was granted permission by SEC to not publicly list it, it will be revealed Saturday a",2882,1axnvdb,https://www.cnbc.com/2024/02/18/buffetts-berkshire-keeps-new-stock-pick-secret-again-what-it-means.html,1090,2024-02-23 06:51:43,,0.10000000000000002,2024-02-23,0
NVDA dip bought +$1.7m,3124,1cdutc8,https://i.redd.it/77hvxotgpvwc1.png,539,2024-04-27 01:24:07,"Bought last Friday. Stock dropped 10% for the flimsiest of reasons (SMCI not doing earnings pre-release), easiest dip buy of my life.


",0.0,2024-04-27,1
"Redownloaded Webull after a 3 year hiatus. It had $45 in the account. Spinned it up. $45 > $9,200 in 15 trading days",3279,1b4qjsf,https://i.redd.it/r5caiqvutxlc1.jpeg,644,2024-03-02 20:46:49,UBER calls before their investor day. QQQ calls the day before NVDA reported. SMCI puts the days it went down 15% (sold that day). Now have IWM calls expiring in late June. 50k or bust in this account. ,0.0,2024-03-02,1
Buyer beware on SMCI,108,1aryyzw,https://www.reddit.com/r/wallstreetbets/comments/1aryyzw/buyer_beware_on_smci/,120,2024-02-16 09:12:23,"If you're not aware of wall street pump and dumps, please refer to [NEGG](https://ibb.co/RgkfsNv). If a stock ""rallies"" suddenly, and retail investors become commited ""intelligent investors"" will often short the stock. I'm not a wizard or Oracle, but I would think SMCI will be shorted when enough retail or outside investors decide to ride the rocket ship. 

Just my 2 cents since I assume most people want to be included in the rocket ride to $2000",0.0,2024-02-16,2
"Coreweave the scam that is inflating SMCI and NVDA growth numbers backed by Crypto bros, Energy traders Private Equity, HF",82,1fcxevz,https://www.reddit.com/r/wallstreetbets/comments/1fcxevz/coreweave_the_scam_that_is_inflating_smci_and/,55,2024-09-10 00:32:33,"https://www.theverge.com/2023/8/8/23824661/coreweave-nvidia-debt-gpu-ai-chips-collateral

https://x.com/Beth_Kindig/status/1832407478748778950

https://research.contrary.com/company/coreweave

Don’t think there’s anybody to trust less than crypto bros, energy trader, Hedge funds, Private equity and mingle that with SMCI a company that couldn’t provide fixed 10-k for 2-3 years and got delisted for fraud.  

https://www.marketwatch.com/story/super-micros-stock-set-to-be-delisted-as-filing-deadline-wont-be-met-2018-08-22

Connected another note is NVDA’s boom in stock price in 2017/2018 was also fueled by selling mass amounts of GPUs to coreweave that they recognized as organic gaming demand and was fined for improper accounting.  Selling GPUs to themselves during the crypto boom.  Coreweave/SMCI/NVDA circular money glitch

https://www.sec.gov/newsroom/press-releases/2022-79

Coreweave is basically owned by NVDA Blackrock Blackstone. Blackrock Blackstone and PE is lending money to Coreweave/NVDA so
NVDA is selling billions worth of GPUs to themselves

https://www.blackstone.com/news/press/coreweave-secures-7-5-billion-debt-financing-facility-led-by-blackstone-and-magnetar/



“None of the founders came from the cloud space before starting CoreWeave. Rather, all came from trading energy futures. While Venturo and Intrator were working together at their hedge fund” 

Six months ago when SMCI was being pushed on to the public I said it was a scam to fleece retail, said they were going to be a ton of lawsuits and they’re all coming

https://old.reddit.com/r/wallstreetbets/comments/1bw9c8l/goldman_sachs_and_morgan_knowingly_offering_scams/

I didn’t know when the timing of the dump was but I said it’d be under $100 in the future before all the accounting fraud reports came.

Digging around and talking with people in the field be very careful when Coreweave get offered, it may pump, even for a year but their numbers are going to be cooked.
 

And as we see SMCI has the same circular money glitch selling/buying from his brother, wife’s company which are located inside the SMCI campus. So I don’t know the exact but it seems very fishy and makes me think PE loaned money to 2.6 billion to coreweave to pump up SMCI and NVDA revenue numbers and they are going dump on retail?

https://hindenburgresearch.com/smci/

I can’t put my finger exactly on it but there’s definitely alarm bells ringing",0.0,2024-09-10,7
NVIDIA is now oversold ,2628,1ba22rc,https://www.reddit.com/r/wallstreetbets/comments/1ba22rc/nvidia_is_now_oversold/,859,2024-03-09 04:29:58,"I'm an old school investor. I enjoy charts and dividends and reasonable sustainable growth over time. Today was a rough day for NVDA stock, but in the grand scheme of things, it was really just a Tuesday. 

The reality is, NVDA was up 7% this week, Monday-Friday. It's massive run up to $974, while exciting, was not healthy or sustainable and a pull back from the intraday open of 5% was a good thing. 

If you're measuring NVDA from it's daily high if 974 to it's close of $875; well, don't. It closed at $926 Thursday and was really just down 5% from that. The AH/Pre market etc on low volume artificially blew that open price up making today look much worse than it was....

So where does it go from here?

Here's the reality;

- AI is the future, we are at the starting line. There's are few precedents for this, so everyone saying it's over bought are missing a key element. The limit is unknown. NVDA very well could be the most valuable company on the planet. 4T market cap is not unreasonable, on continued growth as shown over the last several ERs. We've really just started to scratch the surface.

- NVDA competition is non -existent. They have at least 2 years of runway before anyone can even reasonably expect to be even close to in a position to compete. Even then, NVDA will have advanced and have the advantage. 

- Everyone needs AI chips. They need them because customers are demanding AI, and thus more h100s need to be bought. The demand for AI hasnt slowed. It remains and is accelerating daily. NVDA will continue to make record profits for the foreseeable future as the only real game in time to provide the chips requires to build this new industry.

- Today's sell-off was orchestrated by the big boys (look at how quickly and how well timed it was,) but the big boys will be back in next week, taking advantage of the now cheaper stocks and using the 600% gains from the puts they bought before triggering the sell off to get back on the ride. 

-NVDA is an easy candidate for a split. Whether it happens at $1000 or $850 is irrelevant. But it's coming, and retail will cheer it.

Tldr

BERS are fukt, NVDA gonna more sustainably climb next week another 7% ish next week to ~$922-$930. It will continue this way until $1000 likely between 3/22 and 3/27.

Stop worrying about AH and pre market movements on low volume. Start looking at the longer term growth..",0.0,2024-03-09,0
