title,score,id,url,comms_num,created,body,sentiment,date,mention_count
Reasons why SMCI is the Next NVIDIA,0,1f3iq6u,https://www.reddit.com/r/wallstreetbets/comments/1f3iq6u/reasons_why_smci_is_the_next_nvidia/,26,2024-08-29 00:46:45,"
As you all know SMCI was once at 1200 six months ago, but because smart money in a bid to make profit sold their shares to retail traders all the way down to 400 …putting their profits in lame stocks that are yes outperforming the market …but those stocks aren’t SMCI.

Of course us retail traders on Reddit know more than these institutions. We also know it isn’t our fault we kept buying all the way down leaving many with a cost basis of $800. It’s their fault for wanting to put their money in better performing names.

Guess what though SMCI is the next Nvidia. They will regret the day they sold out of a company with profit margin pressures that loses customers to Dell and HPE. 

What makes SMCI the next NVDA…900 points. 

Yes SMCI may not have any propriety tech or moat, and yes they may not be the only server builder with liquid cooled servers, and yes they no longer get first dibs at NVDA GPU’s… but did those other companies stock go up 900 points in 3 months! The answer is NO…they did not. And that is why SMCI is the next NVDA. Sure it doesn’t innovate any IP and has a difficult time maintaining profit margins and keeping customers, but it did go up 900 points.

To hell with the smart money knowing more about fundamentals than the Reddit community. 

We know something they don’t and that is #900points3months",0.0,2024-08-29,7
From $26 to $6600 on SMCI,153,19auct1,https://www.reddit.com/gallery/19auct1,39,2024-01-20 03:01:11,,0.0,2024-01-20,1
Goldman Sachs and Morgan knowingly offering scams (Archegos)to unload on retirement funds and public. Goldman’s SMCI offering is the next?,112,1bw9c8l,https://www.reddit.com/r/wallstreetbets/comments/1bw9c8l/goldman_sachs_and_morgan_knowingly_offering_scams/,34,2024-04-05 10:11:19,"There’s a lawsuit alleging Goldmans and Morgan offerings and dumping it on pensions, the public

https://money.usnews.com/investing/news/articles/2024-04-04/goldman-morgan-stanley-must-face-investors-lawsuit-over-archegos-collapse

https://ir.paramount.com/news-releases/news-release-details/viacomcbs-announces-25-billion-debt-offering

https://ipo-edge.com/exclusive-tiger-cub-archegos-liquidation-triggers-record-crash-in-discovery-viacomcbs-sources/

Their lastest offering 

https://ir.supermicro.com/news/news-details/2024/Supermicro-Announces-Pricing-of-Public-Offering-of-Common-Stock/default.aspx

Having worked on SMCI hardware for over 15 years there’s something extremely fishy about the price movement, offering considering their lack of AI tech, margins, history of accounting fraud.  

Years ago I talked about AMD and NVDA

 5+ years ago I said AMD at $1.80 would be the best datacenter play

https://np.reddit.com/r/AMD_Stock/comments/9v1n6f/amazon_web_services_aws_pricing_amd_vs_intel/e994dka/

2 years ago when NVDA was under $300 I said they really have no peer in this space. I said it will probably triple in a 2 years even at it's inflated price.

https://np.reddit.com/r/wallstreetbets/comments/qw9glx/im_surprised_there_isnt_more_nvda_talk_before/

https://www.complianceweek.com/regulatory-enforcement/super-micro-computer-former-cfo-charged-with-accounting-violations/29367.article

https://www.prnewswire.com/news-releases/shareholder-alert-pomerantz-law-firm-investigates-claims-on-behalf-of-investors-of-super-micro-computer-inc---smci-302093712.html

I’m not saying to make a play because I don’t know how long this will take to play out but this company literally has no AI tech, weird offerings, dilutions, Goldmans running the market, a history of fraud, being delisted and one of the largest SEC fines.  So many red flags 

I’m more on the tech side but there’s so many alarms about this stock and the offering by Goldmans. Plus think of SMCI selling metal enclosures to house GPUs and CPUs.  We had many SMCI boxes that are 5+ years old.  Yes we’d upgrade the GPU/CPU every few years but the metal enclosure servers that were SMCI we rarely ever upgrade beyond 5+ years.  

PSA Don’t be their exit liquidity.  Lots of red flags, maybe you take a chance when it was $90 but at $1000 up 1000%  in a year and with all these red flags it’s a terrible investment.",0.0,2024-04-05,5
"What Are Your Moves Tomorrow, September 06, 2024",256,1f9vstx,https://www.reddit.com/r/wallstreetbets/comments/1f9vstx/what_are_your_moves_tomorrow_september_06_2024/,6643,2024-09-06 01:27:11,[View Post](https://sh.reddit.com/r/wallstreetbets/comments/1f9vstx),0.0,2024-09-06,0
"SMCI, will you be my valentine? 🫶🏼",182,1aqy1oc,https://i.redd.it/lf2fln8kamic1.jpeg,31,2024-02-15 02:46:39,SMCI & NVDA calls have been making me cream,0.0,2024-02-15,2
"$3000 -> $60,000 🔥🔥",1725,19fcj7y,https://www.reddit.com/gallery/19fcj7y,328,2024-01-25 21:26:54,"Been grinding the past year. Up 2000%. Fuck everyone clowning me in my last post.

Positions were:
SMCI calls

AMD calls

SMCI puts

TSLA puts

ZIM calls

COIN calls

DWAC calls",0.0,2024-01-25,2
Lost on $SMCI :< Shorted all day long... still holding short,88,1aro2mi,https://www.reddit.com/r/wallstreetbets/comments/1aro2mi/lost_on_smci_shorted_all_day_long_still_holding/,43,2024-02-16 01:09:09,"$19K LOSS THUS FAR! 

https://preview.redd.it/v3c3mm02ysic1.png?width=142&format=png&auto=webp&s=4b06984a59ef703de67d4e1d5723a8a37370203d",-0.025,2024-02-16,1
The price action today confirms to me this (NVDA),1135,1avkedm,https://www.reddit.com/r/wallstreetbets/comments/1avkedm/the_price_action_today_confirms_to_me_this_nvda/,516,2024-02-20 21:01:25,"NVDA earnings will and stock will go parabolic

We have seen crypto, AI and chips thrive the last few months. SMCI last week was an early indication of this pullback as big money pulls some out before loading it back in tomorrow.

Prediction is NVDA goes north of $750 by EOW. Yes > 10% gains in next few days. They had to drop it to show the increase wasn’t so bad.

Good luck and buckle up today is choppy and 🌈 🐻 can only ever rejoice for moments in the market. It’s all fugazi",0.1,2024-02-20,1
A Tale of 2 Cities $SMCI,73,1elsw7b,https://i.redd.it/z015i2wvw3hd1.jpeg,15,2024-08-07 02:22:40,AH: $620 -> $724 -> $594,0.0,2024-08-07,1
$2k > $148k | Gather Around The Camp Fire,1589,1arrblc,https://www.reddit.com/gallery/1arrblc,285,2024-02-16 03:21:00,"Gather around the camp fire for my story guys. 

Initially invested $2,000 into my investment accounts. Previously had $36.81. Immediately invested in NVDA until funds settled. Once settled invested in NVDA 02/09 560 Calls. Deposited $2,000 more into account and invested that in SMCI stock when $436. Once settled rolled that into SMCI 02/02 495 Calls the day of their earnings. Earnings did great and rolled those into SMCI 02/23 540 Calls.

Sold NVDA options and rolled into ARM 02/09 76.50 Calls day before their earnings. Earnings did great. After ARM earnings rolled into ARM 2/23 120 Calls. Opened a few more SMCI positions ahead of NVDA earnings. 

Also holding stock in NVDA and SMCI.

See you all in the promise land after Nvidia earnings.",0.0,2024-02-16,5
What’s your thoughts on SMCI,15,1algwdy,https://www.reddit.com/r/wallstreetbets/comments/1algwdy/whats_your_thoughts_on_smci/,53,2024-02-08 04:50:26,I caught SMCI late because I initially thought it was a meme stock. I caught it Friday trading around $550 and threw a hundred into some far out the money calls that turned into 1k on Monday. It’s been making $50 intraday moves versus its previous $50 bullish moves these past couple days. A lot of people are calling for it to sink. What’s your thoughts?,0.0,2024-02-08,2
"SMCI: Attractive Valuation, Great Potential",13,1e7hquw,https://www.reddit.com/r/wallstreetbets/comments/1e7hquw/smci_attractive_valuation_great_potential/,24,2024-07-20 05:02:11,"**POST-EARNINGS UPDATE:**

SMCI just delivered very disappointing Q4 results as gross margin (11.2% v 15.5%) and EPS (6.25 v 8.1) fell short of the lower bound of their previous update. The problem with FCF has also become severe.

Although their revenue guidance is still optimistic, **I no longer buy their EPS prediction**. Therefore, I need to acknowledge that my prior understanding of this company is wrong.

**I now downgrade my rating of this stock, from overweight to underweight. The price target is adjusted from 1050 to 600.**

**The earnings, on the other side, confirm that NVDA has a very strong quarter.**

**Original Post:**

AI frenzy is unfinished, yet the broader market suffered from a significant retreat this week. The PHLX Semiconductor Index dipped 6.86% on Wednesday, the worst performance since the pandemic. NVDA barely holds the 118 level, while other stocks such as MU, QCOM, AMAT, LRCX, ASML, etc., have dipped below key price levels. They are seeking support on MA120 (or at an even lower price).

I am paying attention to **SMCI**, a stock that may be less focused these days. SMCI lost more than 12% this week and closed at a price below 800. However, this dip has offered unique opportunities, reducing its post-earning risks, and making the price very attractive. Here is my analysis.

0. My Position:

**18 SMCI 01/17/2025 1200 C, 6 bought this Wednesday and Thursday at an average price of 71.6. My average cost is now 110. Although I have suffered a loss of 35%, I am sure that this is just temporary.**

1. Valuation:

**SMCI is trading at a PE TTM of 44.63 and a 1-yr forward PE of 22.17**. This is a very attractive price given its growth this year and the year to come. As a comparison, DELL is trading at a 1-yr forward PE of 16.17, with its growth much slower than that of SMCI.

SMCI is offering the market its unique stack-scale liquid-cooling system that can customized. With the surging demand for liquid cooling for AI server applications (especially the application of the NVDA B series), I expect SMCI to expand its portion in the AI server market while maintaining its current gross margin. The fundamentals of the corp are solid and I see great visibility in its future performance.

2. Technical:

SMCI is trading at a support level of 760-805 which is ultrastrong, which marks the dividing line between the bullish and bearish momentum. We can see that this level has been tested multiple times in the past 2 months, while strong buying has supported the stock in this range. All MAs (up to MA120) have converged, indicating the bottom consolidation to come to an end.

Besides, **the current price is only 7% higher than the closing price of the previous earnings call, while its peers in the semiconductor industry have surged by more than 20% (e.g., 25% for NVDA).** This indicates that the market may have digested the possible scenario of the stock failing to deliver results that are good enough. This risk-off emotion will help relieve some post-earning risks.

3. The broader semiconductor industry:

ASML delivered very good Q2 results, with a <2% miss on its revenue guidance for Q3. TSM just delivered a blockbusting earnings report that beat the top and bottom lines on both quarterly performance and guidance. This indicates that chipmakers such as NVDA are having a very good season with demands surging even more than before. **This indicates that SMCI is also having a very great season where I expect its revenue and EPS to beat its bar which has far exceeded the market consensus**.

4. Rating:

**I now initiate an 'Outperform' rating for SMCI. The 12-month price target is set to be 1050, which indicates a potential upside of about 35%.**

The expected forward valuation is about 30, somewhat larger than its peers simply because of its growth.",0.5333333333333333,2024-07-20,12
My next play: Bullish on HPE earnings,570,1d44ra1,https://www.reddit.com/r/wallstreetbets/comments/1d44ra1/my_next_play_bullish_on_hpe_earnings/,814,2024-05-30 19:31:17,"HPE is definitely the red headed step-child in the server market. However, at this point its valuation is becoming attractive.

My bullish case is:

1. They haven’t really participated in this AI rally yet like SMCI or DELL.
2. I think they finally are getting their shit together and actually bringing compelling (or at least viable) products to market. At least all of their marketing messaging seems to be all in on AI.
3. Shares and calls are cheap.
4. If Dell does well on earnings, I think HPE will also get a lift. You can play it more risky by getting in today, or safer by getting in after Dell ER.

So, I’m just hoping for the “me too” effect here next ER mostly.

Position: 200 $20c for 6/7 and 200 $20c for 9/20.

Edit: Hey Mods, can I get a flare... like ""WSB Tech Anal-ist""",0.0,2024-05-30,1
"I am no longer banned and in order to fix my macro $baba pain, I went micro $smci calls. Now we embark on epic yolo adventure. ",43,1cszps2,https://i.redd.it/8bgm9uf6jo0d1.jpeg,29,2024-05-16 05:32:57,"I wish I trusted myself like I did on $baba but I played it safe to see if after my banning by Reddit, for heckling someone being rude my isolation had restored my powers 

Foreshadowing. I sense 🌈 🐻 forming a epic crash of nvidia miss and bad jobless report 👀👀👀

Bidens China hate will hurt nvidia numbers and this will be the Q it shows itself . However semis will run through Wednesday 

Dead fucking baba out ",0.1,2024-05-16,0
SMCI Puts to bounce back from NVDA loss,14,1f3ukoa,https://www.reddit.com/r/wallstreetbets/comments/1f3ukoa/smci_puts_to_bounce_back_from_nvda_loss/,15,2024-08-29 10:44:30,"I'm in full cope. Tryna decide on what kind of SMCI Puts Imma buy. Maybe earn a few bucks back and get back on NVDA once it settles and starts to recover. What kind of positions r u guys planning to get?

Looking at short September Puts around/above 400. Not too far from current trading price.

I don't think SMCI's gonna bounce back for a while after the mega after hours dip from the Hindenburg report.

Edit: Nvm u guys right the options r super ex pre-market this was delulu gotta calm down before market opens",0.0,2024-08-29,3
WSJ reports Department of Justice probe on SMCI,42,1fpyct5,https://www.wsj.com/tech/justice-department-probes-server-maker-super-micro-computer-2ca6a4d3,7,2024-09-26 20:33:49,,0.0,2024-09-26,1
"SMCI ber here, pull out or hodl?",9,1axcos5,https://www.reddit.com/gallery/1axcos5,46,2024-02-22 23:19:50,,0.0,2024-02-22,1
Okay THIS time I’m actually done,932,1d8pcno,https://i.redd.it/0kf9swj54r4d1.jpeg,300,2024-06-05 18:30:36,,0.25,2024-06-05,0
SMCI BAG HOLDERS ASSEMBLE,10,1enldhz,https://www.reddit.com/r/wallstreetbets/comments/1enldhz/smci_bag_holders_assemble/,18,2024-08-09 05:30:53,"ATTENTION SMCI PEEPS

We need to speak up and meet in person at the SMCI headquarters and have a talk with Charles. Basically he needs to fix this. The earnings call could have gone a lot better if he just fudged the numbers a little bit. Why did he have to be so literal and kill the vibe. 

Sometimes the truth is not the best course of action…sometimes a CEO needs to be creative and say the business isn’t f’d from competition by other companies. To hell with HPE and Dell. Outside of them offering more services like cloud backup and customer support, they can’t even hold a candle to SMCI which once traded at $1200 without any IP or moat whatsoever. 

Charles needs us and our opinions. Maybe if we explain to him nicely that the stock needs to be at 1200 so many of us can break even, he will understand our plight. 

My suggestion is that he puts out a video and retracts some of his previous statements about margin  pressure. Just say “oh I totally messed up these numbers. We actually are at 14% profit not 11%. Doug the assistant made a typo when handing me the GAAP numbers. Not to worry we laid him off. So that frees up another 80k for CAPEX from Doug’s salary.” Or something along those lines. Maybe he can get all his work buddies together as well and buy some company stock to boost it from the inside. 

Anyone have any other suggestions? 

Also, Iif anyone knows Nancy Pelosi or has a way to get a hold of her maybe we can explain our situation in hopes she buys some options or shares in SMCI. That will get it to 1200 in a weeks time. ",0.0,2024-08-09,5
Thank the Lord for SMCI (GUH!!!),139,1b6cib3,https://www.reddit.com/gallery/1b6cib3,23,2024-03-04 20:11:04,Bought these calls on Thursday with absolutely no idea it was going to skyrocket. Regarded trades for the win!,0.0,2024-03-04,1
"Daily Discussion Thread for August 27, 2024",163,1f2d6o1,https://www.reddit.com/r/wallstreetbets/comments/1f2d6o1/daily_discussion_thread_for_august_27_2024/,8578,2024-08-27 15:27:10,[View Post](https://sh.reddit.com/r/wallstreetbets/comments/1f2d6o1),0.0,2024-08-27,0
SMCI,18,1e1hrds,https://i.redd.it/uww33xybb3cd1.jpeg,19,2024-07-12 19:01:09,Do I have enough time to profit?,0.0,2024-07-12,1
guh SMCI,57,1ayeqim,https://www.reddit.com/gallery/1ayeqim,34,2024-02-24 04:38:10,"It’s incredible that we live in a world where with just a few clicks and a few minutes, numbers on a screen can change so drastically. 

Edit: cropped photos",0.0,2024-02-24,1
My All Time Robinhood Chart is a Masterpiece,1936,1ayjtqp,https://i.redd.it/ct2mmqb97gkc1.png,180,2024-02-24 08:28:55,,0.0,2024-02-24,0
Why NVDA is going to moon for next 2 quarters,497,1f2in8c,https://www.reddit.com/r/wallstreetbets/comments/1f2in8c/why_nvda_is_going_to_moon_for_next_2_quarters/,368,2024-08-27 20:06:10,"* In the last quarter(s), the big five have raised Capex spending on AI, and their guidance shows even higher Capex spending on AI infra.
* There is a race to capture AI offerings between Google, Microsoft, Amazon, OpenAI, and other upstarts. Neither can give up that race, even if it means more infra spending. For example, Google's stock fell 20% over a small bug in their AI offering. 
* The LLM model sizes are increasing multifold, requiring more/better GPUs, which means more business for NVIDIA. The previous models are mostly useless.
* Assemblers like SMCI have projected a doubling of sales in their recent earning, even with lower margins. 
* Nvidia keeps an insane margin and keeps raising it. Their ability to tell a story around the lower cost to operate, including net energy and compute has been bought by the market. Huangs says it is cheaper to run AI operations with a million-dollar Nvidia chip than a free chip from a competitor. 
* There is still no competition to either Nvidia chips or the Cuda programming and libraries that almost everyone uses for GPU ops. Nvidia has a 10-year lead on GPU programming and open libraries.
* **A reversal of this trend would have telltale signs. None exist.**

Tldr: Nvidia will beat the earnings and raise. The trend will continue for a few more quarters until a recession hits and Big 5 can't spend on infra. We will have bigger problems than Nvidia stock if that happens.",0.0,2024-08-27,1
SMCI Puts 500+% gains,29,1fq0eyl,https://www.reddit.com/r/wallstreetbets/comments/1fq0eyl/smci_puts_500_gains/,5,2024-09-26 21:59:54,"Not a lot of $ but SMCI puts printed today for 500+% gains.

Bought SMCI puts last week - way OTM for 300P with some time. Was down about 50% till yesterday. 

https://preview.redd.it/uwkzjzxtj6rd1.jpg?width=738&format=pjpg&auto=webp&s=28b5c07e6b3eac58caaa5357d440a33175d388e5

https://preview.redd.it/dwzh837vj6rd1.png?width=2044&format=png&auto=webp&s=cc605df2d1e4a899db9e06566f4a895ffe62505b

https://preview.redd.it/2pf2ntqvj6rd1.png?width=942&format=png&auto=webp&s=9b8a17755072da82338a0324b1b0d95387c552a5

  
",0.0,2024-09-26,3
Are $SMCI Problems $NVDA Gains?,0,1f3fqzk,https://www.reddit.com/r/wallstreetbets/comments/1f3fqzk/are_smci_problems_nvda_gains/,13,2024-08-28 22:44:52,"The collapse of $SMCI is causing some (like Sylvia Jablonski from Defiance ETF's) to say they're buying the dip, while others consider it catastrophic for the company given the ""accounting manipulation"" claim from Hindenburg Research. Their market cap is paltry compared to Nvidia, the company which the world is waiting on right now. $NVDA is down a little bit right now which happens from time to time, and their earnings will probably look stellar, I'm sure.

Are people starting to question whether Jensen's team are playing the same kinds of games? Both companies have seen meteoric growth over the last few years as the very mention of AI causes stocks to moon with virtually no other business case. At the end of the day, it's unlikely this is the end of the rainbow (sorry to the bears) but it does call into question whether the market will temporarily halt excitement on semiconductor stocks in general (the leader of course being Nvidia) or if it is just an isolated incident.

Either people are pulling out of $SMCI like it's the end because it is, or maybe everybody is just rushing in to capitalize on the continued rise of Nvidia. The question is really about whether the entire sector is wrought with fraud, and if so, will that actually impact anything broadly, or if it's just this one company that's getting punished for it now. Either way, the Magnificent 7 are blinking red right now, and it might spill into other things.",0.0,2024-08-28,3
$SMCI: $2K --> 50K,54,1asdoph,https://i.redd.it/ei2kdm8dbzic1.jpeg,32,2024-02-16 22:34:29,,0.0,2024-02-16,1
Round two $SMCI,25,1axfafu,https://i.redd.it/cpb84ti1v6kc1.jpeg,38,2024-02-23 01:01:13,Anyone with me for round 2? $14k 0dte. ,-0.2,2024-02-23,1
SMCI Earnings YOLO,26,1abs803,https://i.redd.it/qrqbcbzyhuec1.png,41,2024-01-27 02:05:55,Let's see you on Monday night!,0.0,2024-01-27,1
$SMCI YOLO,23,1avtgh7,https://i.redd.it/xywkdhoa6tjc1.jpeg,37,2024-02-21 02:59:21,"SMCI better crater tomorrow or I’m fucked

Pray for me regards 🫡",0.0,2024-02-21,2
Credit Spreads on NVDA and SMCI: why wouldn’t these be the move?,5,1asvr9z,https://www.reddit.com/r/wallstreetbets/comments/1asvr9z/credit_spreads_on_nvda_and_smci_why_wouldnt_these/,41,2024-02-17 12:23:46,"Betting on IV crush. With both at historical IV  and next week likely to increase, opening credit spreads seems like a great way to capture some action without risking the biscuit. Thinking April exp. 

Could even open both bearish and bullish directions and still profit, no? How much more do you think IV could rise?

It feels too obvious. What risks am I missing here?",0.0,2024-02-17,1
They got me last week (-55k on travel/leisure) I'm spinning the block with some AI! SMCI,40,1arhrtl,https://i.redd.it/ykivud4mnric1.jpeg,35,2024-02-15 20:48:47,"I'm essentially betting on two things: 

SMCI 950+ tomorrow 

and one more bullshit SMCI + $60 day sometime over the next 6 trading days. I don't need to hit 1070 to win but with NVDA earnings next week I figured I'd give myself a lot of space on the short leg.

NVDA spreads for funsies

GL anyone playing SMCI. This is gonna be volatile as fuck

GL anyone playing",0.0,2024-02-15,4
50K Win on SMCI! My first 5-figure win!,83,1ascufh,https://www.reddit.com/gallery/1ascufh,28,2024-02-16 22:00:51,,0.75,2024-02-16,1
Justice Department Investigation into SMCI,4,1fq2yyg,https://finance.yahoo.com/news/us-justice-department-probes-super-150035464.html,6,2024-09-26 23:45:38,,0.0,2024-09-26,1
Who should replace Tesla as the newest member of the “Mag 7?”,866,1adjfgi,https://i.redd.it/ngrxcmpjbafc1.jpeg,535,2024-01-29 07:18:24,"Tesla clearly doesn’t deserve to stand beside the likes of NVDA, GOOG, META, etc. made more evident by its disastrous earnings report.  Who do you think should replace Tesla?  NFLX is almost back to its pre-drop level but investors have lost confidence in its questionable business decisions.  AVGO could be a contender but it’s not as flashy.  What do y’all think?",0.0,2024-01-29,0
SMCI Call gain,24,1fqe9fj,https://i.redd.it/d0lzd1q5q9rd1.jpeg,4,2024-09-27 08:36:57,I’m glad I wasn’t restarted and held lol,0.0,2024-09-27,1
Down 5k on SMCI calls then flipped to puts and up 5k,132,1asb434,https://www.reddit.com/gallery/1asb434,21,2024-02-16 20:49:46,Some people say I don’t know what I’m doing and they are right,-0.15555555555555559,2024-02-16,1
$140 to 3.6k,1049,1fq75ug,https://i.redd.it/fh1ruy46z7rd1.jpeg,121,2024-09-27 02:44:05,,0.0,2024-09-27,0
Nvidia Heading Down to $95 again?,529,1emioq4,https://www.reddit.com/r/wallstreetbets/comments/1emioq4/nvidia_heading_down_to_95_again/,333,2024-08-07 23:29:56,"Nvidia and the market are like a rollercoaster right now. It's just relentless selling pressure where it seems like we can't sustain a rally despite analysts saying earnings will be good. There's good and bad news right now but seems like all the bad news is getting much more attention to the point where it's just sell out of fear or because everyone else is.

That and knowing that SMCI, while they dissapointed on earnings (again) did actually raise guidance is good for Nvidia?


The selling and talk of $800 and $700 stock prices in the same month earnings should be great is just odd",-0.15555555555555559,2024-08-07,1
I like this stock $SMCI,60,1ary67f,https://i.redd.it/y5yhs5tu4vic1.jpeg,25,2024-02-16 08:30:42,"Shorts are recycling shares at the moment. I think we’ll see the top blow off to $1150-1200!range tomorrow. 

Fully expecting a correction to come soon. When it does, I’ll be rotating into March or April puts. 

Stay tuned, regards. If we play it right, we be rolling in tendies.",0.0,2024-02-16,1
