title,score,id,url,comms_num,created,body,sentiment,date,mention_count
AI trade reminds me of the telecom bubble at the turn of the century.,1123,1dezbsu,https://www.reddit.com/r/wallstreetbets/comments/1dezbsu/ai_trade_reminds_me_of_the_telecom_bubble_at_the/,654,2024-06-13 19:13:20,"Just wanted to share a few thoughts I have related to the current state of the AI buildout and get your feedback.

The AI buildout reminds me a lot of the late 90s and early 00s when there was a race to build out large telecommunications networks to provide the bandwidth to support all of the new activity that would take place on the rapidly rising technology. 

Companies like Cisco and Lucent went parabolic as a large number of embedded providers (AT&T, Verizon, Comcast, etc) and new entrants (Qwest, Level 3, Global Crossings, etc) received large amounts of capital to build out new IP networks.

The problem was that the investment in network infrastructure greatly outpaced people’s ability to monetize it.  It took nearly two decades to absorb the network capacity glut and there were only a couple winners when it was all said and done, with a ton of companies absorbed and destroyed in its wake.  Cisco still hasn’t reached its all time high over two decades later and Lucent and other equipment providers lost a ton of value and were absorbed as demand for their products declined sharply.  And the winners of the internet buildout were not the companies being touted during the dotcom bubble.

I feel like we’re in the early stages of a similar cycle.  NVDA is like the telco equipment providers with the added benefit of not having any real competition and there are so many companies rapidly deploying their chips to make sure they get in on the AI game.  I think NVDA will continue to soar until the buildout is complete.  Large companies like Microsoft, Google, and Apple are racing to build capacity just like the telecommunications service providers back in the day and there are a bunch of new entrants fighting for mindshare.  Unfortunately no one has really figured out how to monetize the technology yet.

My prediction is that the AI trade over the next two years will looks like the culmination of the telecommunications bubble.  Huge ramp over the next two years as companies race to build out capabilities, followed by a rapid decline as companies fail to figure out how to monetize the investment.  NVDA will stick around but after it reaches its ATH it will struggle like Cisco did after the capacity glut is reached and the folks that actually figure out how to monetize AI will be different than a lot of the companies that are being bet on now.

TLDR, u think we’re in the beginning of a bubble due to rapid capacity buildout, followed by a crash when the industry can’t monetize the technology fast enough to pay back the investment, and then steady growth as the technology matures and new entrants rise on new and unforeseen AI applications.

What do you all think?",0.0,2024-06-13,0
SMCI. What’s Next?,36,1acfvdi,https://www.reddit.com/r/wallstreetbets/comments/1acfvdi/smci_whats_next/,92,2024-01-27 22:52:40,"What do you guys think will happen with SMCI when they report earnings? Granted, it’s already shot up 61% in a month, plus the preliminary results they gave a week or 2 ago aren’t set in stone so there is room for them to beat their own updated estimates or even miss. I’m hoping they beat their own estimates, announce a deal, or offer a stock split.",0.0,2024-01-27,2
3k to 120k in roughly a month,2161,1axo3j7,https://www.reddit.com/gallery/1axo3j7,397,2024-02-23 07:02:38,Todays gains and YTD gains thanks to SMCI and semi conductors,-0.1,2024-02-23,1
The NVDA/SMCI/AMD/etc. bubble is likely to grow a lot more,83,1bczm0r,https://www.reddit.com/r/wallstreetbets/comments/1bczm0r/the_nvdasmciamdetc_bubble_is_likely_to_grow_a_lot/,63,2024-03-12 20:42:45,"In previous weeks, we would see incredible buying in afterhours on the semi-conductor stocks, specifically SMCI, but all of them really. Then, this last week, this red week, we would still see buying in afterhours giving some hope for a recovery, to then again have sell-offs at open. This behavior fits the repositioning of large institutional investors who still have a lot of demand, but do not want to inflate the price too much. 

So, how does this behavior fit the repositioning of large institutional investors who still have a lot of demand for these semi-conductor stocks? Why is an observation on such behavior accompanied by a larger likelihood for the reason that these institutional investors are repositioning and still have demand?

Firstly, when large institutional investors buy a lot of a certain stock during after hours, this inflates the stock price due to lower liquidity. Then, secondly, if the large institutional investors sell off a lot of their shares of this stock at market demand when the market opens, they can sell them for the relatively higher price as the stock won't drop as much as it would have when they sold those shares in afterhours. There is more liquidity in regular trading hours.

Thus, they make a profit. That profit is not huge, but allows the strategy to be sustainable. Because, the real goal of the strategy is to influence the market to sell off as well. Upon seeing those incredible heights reached in afterhours or premarket, people get nervous, and then when a large drop happens at open, some of the nervous ones will sell off. Therefore, not only will they turn a slight profit, but new shares will become available to them at lower prices as well. The stock price will drop to a point where the large institutional investors can safely enter a large position again during regular trading hours, which then does not inflate the stock price as much due to the higher liquidity. Then, when regular trading ends, they inflate the price again, sell off again, etc. As a result, the institutional investors are able to increase their position size relative to the rest of the world while holding the price somewhat stable. Given that shares of big names are often owned mostly by large corporations like BlackRock, it would make sense for them to manipulate the market in this legal way so that they can gain similarly large positions in stocks which are approaching those big names.

However, that does mean that at some point, the weak hands will be shaken and those shares will be in their pockets; the aftermarket strategy will not work any more, and any buying they do from that point onwards will inflate the current bubble even more. For these reasons, I believe the poppening won't happen for a long time. Diamond hands baby.

Positions: 3k in calls on TSM split between 160C and 149C ending 15/03, maybe too risky as who knows how long this will last, but oh well, I believe there aren't many weak hands left.",0.25,2024-03-12,2
SMCI to be included in the S&P500,108,1b4a39w,https://i.redd.it/l18xwy13ctlc1.jpeg,58,2024-03-02 05:40:05,,0.0,2024-03-02,1
Are you guys okay?,2329,1f3fc8e,https://i.redd.it/j3kk6xs6rfld1.jpeg,135,2024-08-28 22:28:40,,0.5,2024-08-28,0
SMCI - this is far from over,32,1f4xep2,https://www.reddit.com/r/wallstreetbets/comments/1f4xep2/smci_this_is_far_from_over/,30,2024-08-30 20:30:21,"SMCI has some nice niche products, but SMCI’s margins are tiny because they offer nothing proprietary.  
I have a feeling that they were on a roll, but the management couldn't quite keep up with success and the stock went up too high in valuation believing the company internally could keep up with the pressure.

For a company which has no moat, has shrinking margins and is again encompassed in accounting problems, I don't see an upside. I can understand that mistakes happen, but this is becoming a pattern recidivist behavior, and in my book, the trust is seriously shaken, if not lost.

I can understand skepticism around Hindenburg report, but withholding the release of annual report (10-K) is a big no no. Some jumped to SMCI's defense that they did so because of Hindenburg report to make double-checks, but why would you need to double-check a report which was previously audited by independent party (EY) and is supposed to be ready for submitting weeks ahead of deadline?  
For those that aren't aware, 10-K is a kind of report that contains comprehensive overview of company's financial performance over the past fiscal year, but also includes audited financial statements, unlike quarter reports which are less detailed and are unaudited ([link to 10-Q](https://app.quotemedia.com/data/downloadFiling?webmasterId=90423&ref=318292688&type=HTML&symbol=SMCI&cdn=f006c6d17a8677ce2f9e8b184a14bbb0&companyName=Super+Micro+Computer+Inc.&formType=10-Q&formDescription=General+form+for+quarterly+reports+under+Section+13+or+15%28d%29&dateFiled=2024-05-06)). 10-K also includes discussion and analysis (MD&A), risk factors, organizational structure, executive compensation, subsidiaries, and more.

Moreover, there are reports that buyers (such as CoreWeave, Tesla, Amazon AWS, Digital Ocean, to name a few) are switching to competition (which has higher margins), and from being the top customer, to having Nvidia CEO Jensen Huang publicly endorsing their competiton ([“Nobody is better at building end-to-end systems of very large scale for the enterprise than Dell.”](https://finance.yahoo.com/news/dell-escapes-nvidia-shadow-own-133820520.html)),one has to ask - what is really going on?

I believe that, at least partially, the reason lies in that (to quote [mod from SCMI subreddit](https://www.reddit.com/r/SMCI_Stock/comments/1emlh0s/comment/lklblb9/?context=3)) *SMCI was very cheap in 2022 and 2023 when the circumstances were different. Nobody knew about their success back then, which allowed them to avoid competition and actually increase sales and margins.*  
*Now is a different story: they are at diseconomies of scale and diluting shareholders to finance their operations. I wouldn’t be surprised to see SMCI drop to the 300s or lower and never recover because they are just a commodity company now.*  
Dell, HPE and Lenovo aren't resting and have joined the server building market in the meantime.

Institutions which haven't closed their positions already will have a hard time explaining why they kept their position when this stocks sinks even more.

Even insiders believe in everything so much, that the insider net stock purchases in last 12 months amount to 0. One would think that they would grab stocks with hands over fist with this ""great discount"", but I guess they don't want more shares. Source: [https://www.nasdaq.com/market-activity/stocks/smci/insider-activity](https://www.nasdaq.com/market-activity/stocks/smci/insider-activity)

Buybacks? With increased CAPEX and lower margins, the need for money for R&D, and with history of dilutions, I'd be more concerned of further dilutions.

To top it all of, in all these commotions, some of you might have missed a little interesting detail. On August 15, 2024 SMCI added Susie Giordano to it's board of directors. ([Link](https://ir.supermicro.com/governance/board-of-directors/person-details/default.aspx?ItemId=ce4d4770-623d-4e66-a6c9-2679d0c68221))  
Her background is law, and *Ms. Giordano has over 25 years of experience advising executive management and board directors on a wide range of topics, including strategy,* ***litigation, compliance, regulatory matters, corporate governance***, ESG, executive compensation, ***financial reporting, crisis management***\*, cybersecurity, human capital management, ***investor relations***, M&A, ***securities, shareholder engagement, and treasury matters***.  
To me, this is very peculiar timing. She gets appointed to board of directors just mere (12) days before Hindenburg reveals their report and before we find out about 10-K delay, indicating that there could be undisclosed problems and SMCI management is/was aware of it. Where there's smoke, there's fire.

With all that said, I am very bearish on this stock and will be buying long puts.

TL;DR: SMCI is a total dumpster fire - no moat, shrinking margins, losing big clients, and can't even get their 10-K out. Insiders aren't touching the stock, and now they're bringing in a lawyer - betting on this sinking ship with puts all day!",0.1,2024-08-30,11
$560K SMCI gains.,216,1b96vrn,https://i.redd.it/bubbatz4jzmc1.jpeg,35,2024-03-08 03:34:26,"SMCI still going after hour perhaps $1200 by tomorrow? I haven’t exercise my options yet so my gain will probably be $600K by tomorrow if price action continues. 

",0.0,2024-03-08,2
NVDA or SMCI?,0,1f0h11o,https://www.reddit.com/r/wallstreetbets/comments/1f0h11o/nvda_or_smci/,36,2024-08-25 03:41:17,"As we all know by now, NVDA will be posting its earnings report next Wednesday after market close. I believe it would be reasonable to expect a $10-$20 jump assuming earnings have a positive result. As for SMCI, I would expect around a $200 jump, assuming that it hovers around its current price. Obviously, a spike that large would mean significantly larger gains for those who invest in SMCI beforehand compared to those who invest in NVDA. However, it isn't guaranteed that SMCI will increase at all due to NVDA's earnings and could instead pose a giant risk to investors. Although we are all regards, two heads are better than one, so I would like to hear the thoughts of WSB on this.

https://preview.redd.it/wbzp4mx8rokd1.jpg?width=201&format=pjpg&auto=webp&s=44c1daaa8981ce3ffd26d2457b0903086078f8a2

  
",0.0,2024-08-25,4
SMCI joins Nasdaq 100 index beginning July 22nd 🚀,95,1e2045k,https://i.redd.it/wz2cplgxb7cd1.jpeg,28,2024-07-13 08:31:37,,0.0,2024-07-13,1
SMCI,48,1de78wh,https://www.reddit.com/r/wallstreetbets/comments/1de78wh/smci/,41,2024-06-12 19:25:10,"Hello fellow regards,
Currently SMCI is trading around the $770 to $800 range and is crucial to the future of AI as they have partnerships with Nvidia and AMD, due to providing complementary AI server systems. Due to their partnerships, and the increasing demand for AI server systems, SMCI had their EPS increase significantly as their EPS forecast is around $8.00 per share, which is a major increase from last year, which was $3.51 per share. They also have a PE ratio that is lower than Nvidia and AMD at around 45, a foward PE of 21.79 and a PEG ratio of under 1. As a result of their PEG ratio being below 1, it means that the company is considered as undervalued, and a good investment to have. The stock is down 40% from ATH and i personally believe that it could reach over $1000 by their next earnings release which is in the end of july. 

Currently holding 20 shares of SMCI at an average of $776 per share.",0.0,2024-06-12,4
SMCI in the S&P500. The top is in?,70,1b47qse,https://i.redd.it/fnqxe97wuslc1.png,57,2024-03-02 04:03:43,,0.5,2024-03-02,1
$180->200k->40k this month,1690,1asd1fc,https://www.reddit.com/gallery/1asd1fc,426,2024-02-16 22:08:44,"Had insane luck this month with SPY, MARA, and then SMCI. Went up to 190k yesterday and full ported SMCI calls and didnt sell right at open for the first time when I was up to 400k unrealized. Greed got me with this dip today...guh. Oh well im putting the 40k back into SMCI calls today, see what happens.",0.0,2024-02-16,3
NVDA & SMCI Earnings YOLO,16,1dz9gyd,https://i.redd.it/4iq1iloubjbd1.jpeg,40,2024-07-09 23:48:26,"Hello fellow wetards, I am using my down payment fund to yolo into SMCI and NVDA calls for earnings. My elevator pitch DD is below 🚀

DD: SMCI inclusion into Nasdaq, earnings, and overall economic outlook is getting better. NVDA will go up because it’s NVDA. 


Positions: 5x SMCI 1200 c 8/9 
10x NVDA 130 c 8/23 

",0.0,2024-07-09,4
"Have your boomer parents or uber started talking about NVDA, AI? Is it time exit this ride.",1431,1bztupp,https://www.reddit.com/r/wallstreetbets/comments/1bztupp/have_your_boomer_parents_or_uber_started_talking/,405,2024-04-09 20:11:17,"Preface this with I'm a big NVDA AI fan been on the AI train for years before this

2 years ago when NVDA was under $300 I said they really have no peer in this space. I said it will probably triple in a 2 years even at it's inflated price.

https://np.reddit.com/r/wallstreetbets/comments/qw9glx/im_surprised_there_isnt_more_nvda_talk_before/

I was playing golf at my club and guys who were 60+ on the tee box were talking nvda and smci and everything they said was wrong.  Then I walked into the restaurant to eat and again I heard the boomer pro talking about it. Funny thing was I remember him dogging on it when it was sub 200 having too high a PE

I had a plan and my limit order sold at 900 awhile back but when my mom asked about NVDA I just had that sinking feeling like she asked my about my decentralized currency when it hit ath but my limit order had not filled .  I remember her asking about my currency around nov 2021 at thanksgiving which was literally the top, and again at thxgiving or christmas years prior in 2013 and 2017 she again called the top.

Bless her but my mom and boomers have a way of warning about the top.

EDIT: I just think it’s way harder for a company like NVDA which owns 99% of datacenter GPU to keep that 99% and I already seeing AMD, QCOM, ARM, AMZN, MSFT, GOOG, Meta making their own and making in roads and chipping 1% here and there.  

Much like any IT person who worked in datacenters and colocations pre 2016 saw INTC own 99% of datacenter.  It was easy to see it’s very hard to keep 99% and when you lose a few % the “street” or “market” pivots quickly.  

5+ years ago I said AMD at $1.80 I said INTC would start shedding that 99% dominance.  

https://np.reddit.com/r/AMD_Stock/comments/9v1n6f/amazon_web_services_aws_pricing_amd_vs_intel/e994dka/

When you own 99% of the market imo once the pivot happens, it’s almost like a landslide in stock price. And it moves in cycles, companies will buy a bunch of NVDA GPUs and they might add a little bit the next year or the year after but you won’t have large purchases.  No one is buying 1 billion dollars of GPUs every year or quarter.  This business cycles and when it goes down it’ll go down for 2 years and rocket up after when people need to bulk order.",0.0,2024-04-09,0
SMCI,86,1aedzpr,https://www.reddit.com/gallery/1aedzpr,58,2024-01-30 08:23:07,Slowly acquired SMCI over the summer. Picked up at 132-258. One ticker in my portfolio but I’ll see if I can post the options contracts. Called 500-600 by the EOY as seen in my text. Just loving this AI move.,0.0,2024-01-30,2
82k>11k in a month after several bad SPY and SMCI option plays,113,1bduj15,https://i.redd.it/hxe1l1upf4oc1.jpeg,45,2024-03-13 21:08:20,"Like a true regard, I’ve made countless bad options trades that ended up with a total loss of >$70k in the last month. Seems every play I make the market flips the opposite way. Running low on money now but still trying to make it all back somehow and get out of the shit show casino.",-0.3499999999999999,2024-03-13,1
Why is SMCI not a good choice over their competitors?,33,1asn8zh,https://www.reddit.com/r/wallstreetbets/comments/1asn8zh/why_is_smci_not_a_good_choice_over_their/,66,2024-02-17 05:09:14,"After watching the interviews with the CEO, I'm thinking either A it's a total scam with cooked books, or B, his English is not very good and he cannot convey the real value the company has. Without just the usual ""it was a pump and dump"" can anyone in the industry explain why their servers are not as good as the competition? And even if they're inferior, if they're much cheaper, wouldn't this still be needed in a AI boom where everything is backordered due to demand?  
   
I came across this article from 2022 and it made me think huh, they had an insane run then, not that ridiculous for it to happen again riding NVIDIAs coattails. Genuinely trying to figure out if if this is a correction or a full blown dump. I know many will mention technicals and that it'll drop back to whatever the last support/retracement level is but after that, curious for any actual potential.  


[https://www.cnbc.com/2022/12/28/supermicro-almost-doubled-in-value-in-2022-as-tech-stocks-plunge.html](https://www.cnbc.com/2022/12/28/supermicro-almost-doubled-in-value-in-2022-as-tech-stocks-plunge.html)  
",-0.35,2024-02-17,1
Even the Gamma Squeeze on SMCI is Broken,110,1as1oaq,https://www.reddit.com/gallery/1as1oaq,48,2024-02-16 11:41:22,"There's definitely a hint of a gamma squeeze going on with SMCI, as anyone can see the stock has gone parabolic. When you take a look at the options chain expiring this week, there's significant volume at $1,000, $1,100 and even $1,200 (all over 10k contracts traded today) relative to open interest. Market makers, who have to stay neutral, are forced to buy up SMCI stock to hedge their delta exposure as these options get closer to being in the money. This buying activity, especially with just one day to expiration, is partly why we're seeing the price jump—it's a classic feedback loop you get with a gamma squeeze. We also saw an acceleration in momentum during the course of the past two weeks, with 50 point gains the past two Thursdays.

However, even the gamma squeeze looks sorta broken to me. Despite SMCI's share price rising, the implied volatility (IV) for near-the-money (NTM) puts is around double that of the calls, which is the opposite of what we typically see in a gamma squeeze (this is what is referred to as skew). This suggests a market bracing for a possible sharp downturn. High IV for puts increases the cost of hedging, which might discourage new call buying and could reduce the upward momentum from the gamma squeeze. With expiration so close, the rapid time decay, or theta, is eroding the value of these options quickly, which in turn could lead to a decrease in delta-hedging activities. 

I’ll be watching to see what happens tomorrow in the weekly options chains up until at least the March 15th contracts to see if positions are simply being rolled to later dates. If enough people start selling off their positions to realize gains or minimize losses, the stock might stabilize or even sharply retract, potentially breaking the already broken gamma squeeze.",-0.4,2024-02-16,4
"$1,500 ---> $20,000",1656,1aroam6,https://www.reddit.com/gallery/1aroam6,390,2024-02-16 01:18:09,SMCI🚀,0.0,2024-02-16,1
"NVDA, SMCI puts.  Sold half and letting these puppies ride GODSPEED",73,1awid2b,https://i.redd.it/r3flr59r7zjc1.jpeg,53,2024-02-21 23:18:23,,-0.16666666666666666,2024-02-21,1
SMCI,108,1arqkyg,https://www.reddit.com/gallery/1arqkyg,47,2024-02-16 02:51:07,all in on calls expiring tomorrow. looking for half a milli,0.0,2024-02-16,1
Inverse this guy for infinite money,5016,1ascux0,https://i.redd.it/m4f7xbth5zic1.jpeg,137,2024-02-16 22:01:25,,0.0,2024-02-16,0
SMCI yolo,36,1axk08g,https://www.reddit.com/gallery/1axk08g,58,2024-02-23 04:07:00,"Historical meme attached for your enjoyment as well 

Had 25k. Price was 25.  Meant to be",0.0,2024-02-23,1
SMCI insider trading??,19,1fq1q21,https://i.redd.it/6gx610w7u6rd1.jpeg,19,2024-09-26 22:54:24,"Looking at SMCI 400Ps expiring tomorrow, 810 contracts traded at 9:42 in the morning. Roughly an hour before the DOJ news dropped.

$4000 to 1M++ in a day?!",0.0,2024-09-26,2
$SMCI ALL IN,35,1ajk2li,https://i.redd.it/f81q8en7jsgc1.jpeg,61,2024-02-05 21:37:34,"It’s free money at this point 

$SMCI $665 / $700 Calls Expiring Friday",0.0,2024-02-05,2
Smci ,38,1enbh8m,https://i.redd.it/gav8903z2hhd1.jpeg,25,2024-08-08 22:39:55,,0.0,2024-08-08,0
$SMCI is Technically Setting Up for the Rare Brachiosaurus Pattern,276,1avtfhk,https://www.reddit.com/gallery/1avtfhk,23,2024-02-21 02:58:17,,0.15,2024-02-21,1
Space is the next big trend after AI,1100,1b0il15,https://www.reddit.com/r/wallstreetbets/comments/1b0il15/space_is_the_next_big_trend_after_ai/,655,2024-02-26 19:47:53,"If I’m not mistaken in terms of real products (shitcoins aren’t a product son) the massive last bubbly runs we had are : 

- EV’s 
- AI powering chips 

I am talking about something that does not make any sense, the whole industry gets inflated to preposterous levels because of a general euphoria for the industry no matter how shitty their product or business model is (NIO, Rivian, SMCI etc…). 

And we have seen the enthusiasm surrounding $LUNR achievements this past week, the stock went from ≈$2 to ≈$11 in a few weeks ! 

Now imagine when we are going to land actual people onto the moon. Imagine how excited mainstream media is going to be, how excited we are all going to be here on this future easy short that we call Reddit ! 

Everybody will be talking about space, from your wife’s boyfriend to your friends who hate you to your alcoholic father. The astronauts will become stars like Buzz Aldrin & Neil Armstrong & whoever the third guy was back in the day. 

We are still a bit far from launch date but this industry is about to explode and it’s time to load the boat. 

SpaceX will IPO during this time as the excitement will be at an ATH and Elon Muskito nows that. 

What’s the next best thing ? Rocket. Fucking. Lab. 

I am all in $RKLB as they won’t shit the bed like $LUNR did and will one day also offer crewed missions. They are the only reliable company other than SpaceX in this space, they are the only ones flawlessly executing.

$RKLB is your next ticket to the moon and it’s time to board (gosh this is lame AF but very neat too so welcome and fuck you) 




",0.0,2024-02-26,1
