title,score,id,url,comms_num,created,body,sentiment,date,mention_count
SMCI 1 day later,10,1dfc87a,https://www.reddit.com/r/wallstreetbets/comments/1dfc87a/smci_1_day_later/,19,2024-06-14 04:29:18,"Hello fellow regards,
Yesterday i had made a post on this subreddit about how SMCI is an undervalued stock, and that it is heavily involved in the future of AI, due to them supplying server systems to big companies such as AMD and Nvidia. 
I had also stated that the stock is undervalued, however, even though the stock had skyrocketed 12.5% today, i still strongly believe that the stock is still undervalued at $875 as it hit $960 a month ago and $1229 around march.

The company also had stated that they want to supply 1000 liquid cooling racks per month, and increase their 1% market share to 15% within the next 12 months. This means that the stock has a lot of room for growth and i firmly believe that it can reach a market cap of $75 billion after its next ER, which would make the share price at around $1300.

I am currently holding 10 shares right now, which is down from my 20 shares from yesterday as i had sold at $880. However, if it dips, i may buy more shares, but if it continues to rally, then i may hold onto the 10 shares i have as of right now.",0.0,2024-06-14,2
"Roughly $60,000 SOFI and SMCI Gainz in Two Weeks",111,140e376,https://www.reddit.com/gallery/140e376,50,2023-06-04 19:34:46,,-0.1,2023-06-04,1
36k SMCI YOLO Update,33,1emdtp1,https://i.redd.it/cv3w1azj99hd1.jpeg,8,2024-08-07 20:22:33,I was literally shaking throughout the night as many of the guys were just bashing me with IV Crush. In premarket it was around 529 something so Ijust panicked sell after the market opened I felt a little bad that it made a high around 25 but hey something better than nothing. Overall it was a pretty great experience Also I Added Some RUN Calls before market close yesterday And They worked like a charm also sold at market open didn’t wanted to hurt my winning streak.Will look at another earnings yolo soon💎,0.0,2024-08-07,1
Thanks DOJ! SMCI Puts made up for bad bets on FDX and NVDA,18,1fq0w2s,https://www.reddit.com/gallery/1fq0w2s,2,2024-09-26 22:19:48,"And I’m still holding my NVDA puts!
Gotta hold one of the SMCI spreads a few more weeks, dumped the others. ",-0.22499999999999992,2024-09-26,2
SMCI Technical Analysis ,10,1cnjvk0,https://i.redd.it/bqki3lfwnazc1.png,23,2024-05-09 05:51:02,,0.0,2024-05-09,1
"If this is an AI bubble, then there is a lot of money to be made.",777,1b9m1qz,https://www.reddit.com/r/wallstreetbets/comments/1b9m1qz/if_this_is_an_ai_bubble_then_there_is_a_lot_of/,437,2024-03-08 17:20:25,"I changed my mind and I am going all in, with everything I have, I have decided to play the dice and either kill or get killed. I have only around 5k USD left, I have been unemployed since 5 months due to tech market and I dont have any choice left, either I go all in at this point or disappear quietly.

Here is my plan, according to the research I have done, for this ""bubble"" to peak, we need to see %3000 or similar growth in a short time in many stocks, looking at what happened during dot-com.

Some of the research you can see in this video, there is data on dot-com to compare: Write this to youtube to watch the video (""E7: NVIDIA AI BUBBLE - We Can't Stay Quiet Any Longer""). I didnt want to post the link

My targets:  
NVDA to 2500 or above. (I would even say 4000 for this one but I am taking it softer)

SMCI to 4000 or around.

AMD to 2000 or above  (this is the real deal because I think AMD will ramp up competition against NVDA. This would make AMD around 3 Trillion company)

AVGO to 2000 or above

SMH to 500 or above

AMAT to 500 or around.

TSM to 300 or above

Coming days I will be posting my positions. Wish me good luck. I will start adding more after CPI data on March 12 because I am expecting CPI to come hotter therefore it might give a good opportunity to enter into some of these stocks

Your thoughts?

EDIT 1: Since I promised to post some positions, I will post some. Now I have 3 calls on TSMC. 25 CFD contracts on NVDA, and 20 on AMD. Once they go up a bit, I am planning to transition all positions into call options, cuz you know what? Fuck CFDs. I have a romantic relationship with AMD that I cannot explain, I am planning to go big on that one. TSMC 200 C expires on 28 March.

[https://postimg.cc/rD6tTjT0](https://postimg.cc/rD6tTjT0)

[https://postimg.cc/kBjqFX1n](https://postimg.cc/kBjqFX1n)

I know they are not big positions but I hope to make them bigger :)",0.0,2024-03-08,1
This is the same $SMCI rug pull we witnessed now it's Happening with NVDA just be patient ,38,1b9sdt8,https://i.redd.it/orgzzhj115nc1.jpeg,27,2024-03-08 22:03:41,,0.0,2024-03-08,1
SMCI gain ,0,1ftogxp,https://www.reddit.com/gallery/1ftogxp,3,2024-10-01 19:15:22,"Sold right at open for about a $520 gain, it ain’t much but it’s honest work.",0.0,2024-10-01,1
SMCI,29,1b4hfwg,https://www.reddit.com/r/wallstreetbets/comments/1b4hfwg/smci/,29,2024-03-02 11:50:08,"SMCI is gonna be a buy on Monday. It’s got good projected earnings growth for this year which enables it to easier ustify elevated valuations when you consider these compound over next couple years and crucially makes it hard to short. 
And joining the sp500 is gonna be a huge spike and everyone knows it. 
Sp500 market cap 42 trillion. At the current valuation SMC is gonna be 0.1% of that, so 42 billion. 21-25% of the sp500 is owned by passive index funds that will be forced by buy this stock on mar 18. That’s approximately 10 billion of stock coming solely from the buy side. That’s absolutely huge. At approx 1000 dollars share price that’s 10 million stocks purchased. Average daily volume is 9 million shares. 
As a professional trader, I’d most likely spread this out over the 10 days if I had this order to execute. A 10% bump on trading volume coming solely from one direction has the potential to have a huge impact on price if the volume isn’t there on the sell side. 
If the volume is there, we’ll most likely get a stalemate as people profit take into the spike, but can’t imagine anyone sophisticated enough to have 10 billion to sell that wouldn’t be aware of the forced buying pressure over the coming days and so one would think the sellers be much less aggressive chasing price.
In summary, less likely price gets crushed, could definitely see it rocketing on low sell side liquidity in a backdrop of AI-mania. ",0.0,2024-03-02,2
SMCI - option screwed over by after hours,2,1et9u90,https://i.redd.it/1mtmlzavwwid1.jpeg,9,2024-08-16 04:58:20,"On Monday, I bought SMCI $530 Put 8/16 for $878 when it was hovering at $550

It actually closed at 540-544 and my contract was valued at $1150-$1350 depending on the hourly swing. So you see my limit sell planning to exit in the morning.

However, during after hours it shot up to 565 making my contact worth like $400-600. I didn’t want to paper hand since it might’ve bounced back.

But come today, of course it moons to 600+++ so I just tried to scrap together the $20 left 😢 taking 98% loss.

Would you have 
(A) sold on day 1 for $300 profit? Felt early.
(B) sold on day 2 to stop loss $500? Felt early. 
(C) yolo to expiration? Obviously late. ",0.0,2024-08-16,2
SMCI profits after ~two weeks or less. Sell or hold?,13,1amuxop,https://www.reddit.com/r/wallstreetbets/comments/1amuxop/smci_profits_after_two_weeks_or_less_sell_or_hold/,32,2024-02-09 23:56:31,"When I reviewed my summary from 2023, I noticed a trend that I am selling low too often, so I am just curious what others would do here. I know it is up to me and this is <1% of my portfolio. 

[SMCI over 2 weeks](https://preview.redd.it/iqy0kxb1rlhc1.jpg?width=746&format=pjpg&auto=webp&s=6f3e72f00a62cd04544fb1a73d377296637fb81b)",-0.16666666666666666,2024-02-09,2
What happens to NVDA when china invades taiwan? I guess infrastructure can't be airlifted overnight... What other stock is invasion proof?,615,1d0yx2n,https://i.redd.it/xa7rbpus5r2d1.png,353,2024-05-26 16:31:36,,-0.125,2024-05-26,0
SMCI Saved My Account,63,19axz46,https://www.reddit.com/gallery/19axz46,26,2024-01-20 05:33:24,"I don’t know what happened today to trigger this kind of jump but God damn its mooned my account. 

The main reason I bought it two years ago is simply because I drive by their building on Highway 880 here in the Bay Area almost everyday. They expanded their buildings and they looked pretty nice, saw the sign for Super Micro, googled them and saw that they’re a publicly traded company. 5k later, and added another 5k when they got hit hard to double down. 

On a fukin whim.

For any Motley Fool fans out there, its my first spiffy pop as well, even though it was never on their recommendations lists.",0.0,2024-01-20,1
$5k Gain today on SMCI Put,68,1ci14zj,https://i.redd.it/75cn5kyljwxc1.jpeg,12,2024-05-02 05:17:12,Actually it was $7k gain on SMCI Put but I lost $2k on other calls,0.0,2024-05-02,2
3x SMCI MAY 24 940 P,7,1c5w3az,https://i.redd.it/2b4zsbv9pxuc1.jpeg,23,2024-04-17 05:58:20,Thoughts and prayers ,0.0,2024-04-17,1
I’m ready to get roasted for my smci idiocracy,63,1at3zfi,https://www.reddit.com/gallery/1at3zfi,22,2024-02-17 20:35:19,I bought 2 SMCI contracts on Wednesday for $5.25. I almost sold them on Thursday for $60. After hours SMCI continued to rip so thought I made a good decision not selling. I put in a limit order to sell at open for $120 and then canceled it. The contract peaked in the morning at $127. They would have gotten filled. So instead of a $23k gain I ended with a $1k loss. L,0.2,2024-02-17,2
$SMCI paid up,53,1axlo7b,https://i.redd.it/t16hknz948kc1.jpeg,23,2024-02-23 05:14:46,Only had enough for 1 contract but that 1 contract served me well ,0.0,2024-02-23,1
SMCI,6,1di7v7n,https://www.reddit.com/r/wallstreetbets/comments/1di7v7n/smci/,14,2024-06-18 01:48:46,"On wednesday, i had made a post about SMCI, stating that it is a good investment to have due to the rise of AI and that SMCI has partnerships with big names such as Nvidia and AMD. I had also stated that the stock is undervalued as it had an ATH of around $1220 and that the stock price on wednesday, which was under $800, was a bargain. The next day of making that post, SMCI had reached $876 on the close. However, SMCI had reached a little over $920 today, which is well over $120 higher than what it was since ive made my post about the stock. This means that SMCI was up well over 8% today and up by 16% in the past week. However, i still believe that SMCI is still at a good value, as it has potential to reach over $960 which has been done before, and it could beat its ATH right around its earnings report.

Currently i own 7.5 shares of SMCI, which is 2.5 shares lower than what i owned on friday. Reason for this is to take profit and hopefully could dip buy at around $820 level, and if not, i may invest in ASTS or INTC as i believe they have a lot of potential for growth.",0.0,2024-06-18,8
"What Are Your Moves Tomorrow, February 26, 2024",331,1azyssf,https://www.reddit.com/r/wallstreetbets/comments/1azyssf/what_are_your_moves_tomorrow_february_26_2024/,7041,2024-02-26 02:30:40,"Make sure you're in the [WSB Discord](https://discord.gg/wsbverse)!

Check out our [Earnings Thread](https://reddit.com/r/wallstreetbets/about/sticky?num=2) and [Rules](https://www.reddit.com/r/wallstreetbets/wiki/contentguide). DM the [mod inbox](https://www.reddit.com/message/compose/?to=/r/wallstreetbets)",0.0,2024-02-26,0
"SMCI - Ideals are full, but reality isn't",16,1elwmoa,https://www.reddit.com/r/wallstreetbets/comments/1elwmoa/smci_ideals_are_full_but_reality_isnt/,6,2024-08-07 04:58:25,"Super Micro Computer, Inc. (SMCI) announced its third-quarter and next year's outlook after the market closed. The 2025 revenue is expected to exceed the market expectation of $23.6 billion, with the company estimating annual revenue to be between $26 billion and $30 billion. Additionally, they announced a 10-for-1 stock split in October, both considered positive news.

🚨 However, the second-quarter financial report is not looking good. Although the revenue of $5.31 billion slightly exceeded the market expectation of $5.3 billion, the adjusted EPS was only $6.25, far below the market expectation of $8.07.

In simple terms, the financial report and forecast have mixed results, causing the stock price to experience extreme volatility in after-hours trading. Initially, it surged by more than 20%, but then selling pressure quickly emerged, causing a vertical drop. Currently, it has fallen by more than 11%, showing dramatic fluctuations that truly live up to its reputation as a volatile stock 📉.

I believe this is mainly because the market is still focused on whether the AI theme can achieve actual returns. After the valuation is highly inflated, profits must be significantly better than the market expects.

👉 The issue with Super Micro Computer is not just that the EPS is below expectations, but the gap with the market expectation of $8.07 is very large. This discrepancy is the largest in the past five years for any quarter. This high discrepancy occurred because investors were overly optimistic about the growth of AI servers, resulting in such a large deviation in actual profits. This perfectly illustrates the saying ""ideals are very full, but reality is very skinny.""

Additionally, the second-quarter gross profit margin quickly dropped to only 11.2%, down 5.8% from the same period last year, and more than 4% lower than the 15.5% in the first quarter, hitting a new low since May 2007. A continuous decline in gross profit margin is definitely not a good sign; just look at Tesla. Although Super Micro Computer's revenue continues to grow and slightly exceeds expectations, the gross profit margin is rapidly declining. Selling more but earning less will make the market worry that this industry might be getting too competitive.

https://preview.redd.it/hsrl97jlo4hd1.png?width=351&format=png&auto=webp&s=a32b9d03492cd3321db755d73b0414c11cff6552

",0.35,2024-08-07,2
MSTR and SMCI gainzzz,55,1csx6q7,https://i.redd.it/bnwxft1dyn0d1.jpeg,12,2024-05-16 03:36:15,,0.0,2024-05-16,1
"After the SMCI top, NVDA will be Valhalla or eternal damnation for the market…",80,1avry9f,https://v.redd.it/h9vyrp7pvsjc1,19,2024-02-21 02:00:47,,0.5,2024-02-21,1
"Thought I missed out big on SMCI shares, so I decided to make my own😀",30,1bclkqx,https://i.redd.it/fo8o40wt9tnc1.jpeg,23,2024-03-12 07:35:42,"I would like to credit ARM, AMAT, NVDA and AMD calls for getting me here😂",0.0,2024-03-12,1
Didn’t pull out $SMCI in time,0,1ayfpxv,https://www.reddit.com/gallery/1ayfpxv,30,2024-02-24 05:19:17,"So after browsing this sub for over 5 years, I decided to try an option on my own dime for the very first time. 1 position, 1 day and all gone. Not the end of the world but curious if indicators used were part of the reason I was left with my pants down to my ankles.",0.0,2024-02-24,1
"NVDIA, TSLA, TSM, PLTR, SMCI and QQQ",31,1atgr9x,https://www.reddit.com/gallery/1atgr9x,26,2024-02-18 05:51:33,"

Hello regards, after the crazy market session with SMCI loosing the $1k level , and with NVDIA ER coming to play next week, I saw lots of posts with probable moves on PLTR, TSM, SMCI and others.

Since IV is quit high for options play in SMCI and NVDIA, if the prices tanked we will not see Put or Call gains. However some regards sugested to go with QQQ, trying to capture the NVDIA movement, I did some charts and from my regardness ( I cant read candles, only YOLO charts), my points are summarized bellow:

1. TSLA:  There is a likelihood that TSLA can be rebound if the market start to sell-of NVDIA after the ER. The chart shows migration from TSLA to NVDIA in January.

2. QQQ : seems does not capture the moves of NVDIA, by the chart presented.

3. PLTR: keep the same NVDIA moviment, if one goes down the other goes too...

4.TSM: looks like after Feb/07 investors also have migrate to NVDIA. But TSM also can follow the NVDIA's patterns post ER.

5. SMCI: this crazy rocket since Jan/17 has it own move ...and the NVDIA results or moves can affect only by fear of wich were happened to SMCI (my gues, I am not an expert).

Any thoughts? Something that I missed or my ape brain could not figure out ?

Disclaymer : I have positions in MSFT and AAPL - calls and both are red :(), Put on COIN and Put on CSCO.

But I am considering buying some Calls on TSLA for DTE 03/15, Put on PLTR and TSM.

TLDR: If NVDIA hit the wall after ER, PLTR seems to follow also SMCI, however TSLA has small chance of rebound, since the migration can be reversed after NVDIA ER.",0.0,2024-02-18,7
SMCI 1 week later,23,1dkev19,https://www.reddit.com/r/wallstreetbets/comments/1dkev19/smci_1_week_later/,11,2024-06-20 21:15:42,"Last week on wednesday i made a post about SMCI and how it is undervalued at around $775 to $800 a share. Today it just crossed over $1000 and reached around $1014 per share which is almost a 30% gain within 1 week. This is due to elon musk making an announcement that Dell and SMCI would be building a supercomputer with xAI. Personally im no fan of Elon Musk, but this is good news for SMCI as it will provide the company greater revenue and profit, which will help their EPS grow much more quicker and make the company more valuable. Currently the company has a PE ratio of around 54 and has a market cap of around $55 to $60 billion. This means that if the company continues to grow at its current growth rate, it could potentionally be worth around $150 to $200 billion within 1 year.

Currently own 4 shares of SMCI and may buy more if it dips below $850.",0.0,2024-06-20,5
Everyone Posting SMCI Loss Porn or Put gains so here is some SMCI call gains,38,1asli1g,https://i.redd.it/wmwke5lfw0jc1.png,24,2024-02-17 03:54:28,,0.0,2024-02-17,2
SMCI Bulls Are 🤡🤡,33,1ay928m,https://www.reddit.com/gallery/1ay928m,24,2024-02-24 00:47:41,I can't believe it did the same thing two Fridays in a row.,0.0,2024-02-24,1
SMCI predictions for next week 02/26-3/01,18,1aybjtk,https://www.reddit.com/r/wallstreetbets/comments/1aybjtk/smci_predictions_for_next_week_0226301/,26,2024-02-24 02:28:46,"SMCI tanked last Friday to $800, then tanked some more the following Tuesday (market was closed Monday) to $700 territory, then pumped to $980 on Thursday, then tanked again this Friday (today) to $850.

It seems the stock moved similarly 2 Fridays in a row, but I’m jumping onto this meme stonk pretty late so idk.

There are talks of stock dilution because the company is trying to raise 1.5 billion by selling convertible senior notes based on $975 price per share, which will raise money for them but apparently also dilute existing shares, I don’t understand how this works cause I’m regarded but it sounds like using inflation of the shares to raise money from actual big dog investors.

So what’s the play? Puts or calls? It seems like both are the answer but the question is timing. Probably SMCI will keep rocketing up but will dip in the long run, try not to get burned, but we all know 99% of regards need to burn so that 1% that time it right will be rewarded.

I was thinking about buying calls before market close today but decided not to because of theta over the weekend. Maybe the best play is to buy calls if it tanks at market open on Monday 02/26 or puts if it pumps at market open.",0.0,2024-02-24,3
bad timing on NVIDIA and SMCI calls,39,1ap88zt,https://www.reddit.com/gallery/1ap88zt,24,2024-02-13 00:48:17,"So yall might remember my BABY YOLO.

Well I turned $1.3k to $36k and well I basically YOLOED the entire thing on calls.

Everyone knows these are the riskiest stocks tight now and the most profitable 📈 😳 

Yall think I'm gonna apply at Wendy's or become the manager thatbhires yall to clean the semen off our Wendy's dumpsters?

Am I a regard for this bet?

It keeps dipping lol",-0.6999999999999998,2024-02-13,1
"SMCI, the turd that keeps on giving.",29,1eiofjd,https://i.redd.it/xpes6uwv3cgd1.png,4,2024-08-03 04:53:52,,0.0,2024-08-03,1
SMCI 🚀🚀🚀 $335K gain,96,1amagol,https://i.redd.it/vv306w7ubghc1.jpeg,17,2024-02-09 05:39:00,"Got these calls two weeks ago and finally dug myself out of the black hole.🙏🙏🙏🙏

With NVDA earnings just around the corner, I think SMCI will stay above $700 and rockeT some more in parallel move with NVDA.",0.0,2024-02-09,2
"SMCI due for a major breakout $1,000 PT",6,1ciirdh,https://www.reddit.com/r/wallstreetbets/comments/1ciirdh/smci_due_for_a_major_breakout_1000_pt/,18,2024-05-02 21:07:54,"https://preview.redd.it/aeiz769v81yc1.png?width=902&format=png&auto=webp&s=ff200bf490d237a5631ccf7f26196acc2e7cf5cd

If my tea leaves serve me right, SMCI showing major compression on the 4hr, due for massive breakout, likely next week. It'll be quick.   
PT1 $1,000  
PT2 $1,200 (this would be a stretch)

should see mkt dip tomorrow (Friday) and then rebound up. Will look for an entry then. But SMCI needs to hold this $700 support line. Otherwise it's going to flush down to $615.",-0.03125,2024-05-02,3
SMCI BULLS GOT RUGGED,86,1bit29g,https://i.redd.it/vb2a61d2fcpc1.jpeg,13,2024-03-20 01:05:35,,0.0,2024-03-20,1
And so it begins again …..,886,1av7g43,https://i.redd.it/ieolrbqqrnjc1.jpeg,289,2024-02-20 08:48:52,,0.0,2024-02-20,0
"Stressful Ass Month Swinging NVDA AND SMCI, along with my Emotions. ",43,1aydhuj,https://i.redd.it/zp48jisptekc1.jpeg,20,2024-02-24 03:48:02,"The upswings basically represent NVDA calls/puts and ARM calls, and the fucking freedalls represent SMCI calls literally the fucking minute I decided to chase that muthafuckerr 😢 
Here's to being up $700 the next 4 weeks! 💪",0.0,2024-02-24,2
Easy 💰 🔥 smci/nvda,24,1b31vsw,https://www.reddit.com/gallery/1b31vsw,22,2024-02-29 20:10:44,,0.43333333333333335,2024-02-29,0
"🐋 Microstrategy has just acquired another 12,000 BTCs 😳",818,1bc2c2u,https://www.coindesk.com/markets/2024/03/11/microstrategy-acquires-12000-btc-with-convertible-senior-notes-proceeds/,280,2024-03-11 18:16:22,,0.0,2024-03-11,0
Your new hype toy (SMCI) got denied pretty bad. Mild shock.,0,1aropsy,https://i.redd.it/7c1wudhq2tic1.png,26,2024-02-16 01:35:16,,0.004924242424242456,2024-02-16,1
Divergence between SMCI and NVDA taking place?,10,1bfgrbk,https://www.reddit.com/gallery/1bfgrbk,20,2024-03-15 21:03:47,"I’m looking at the 1 month time horizon between Nvidia and SuperMicro and though they’ve stayed persistent between each other, both ramping up in the bull market together,  it does appear they’re starting to diverge slightly with Nvidia continuing to rise and SuperMicro beginning to fall. Anyone else noticing the same thing as SMCI is trading lower?",0.0,2024-03-15,2
AVGO SMCI calls ,13,1et6th4,https://i.redd.it/cofuue6r9wid1.jpeg,1,2024-08-16 02:48:50,A,0.0,2024-08-16,1
"🫡 MU, LLY, SMCI & PANW",40,1dibmuk,https://i.redd.it/2vhg8i40q77d1.jpeg,4,2024-06-18 04:29:50,,0.0,2024-06-18,1
Should I hold the SMCI call or not ?,1,1bk8o7t,https://i.redd.it/srlt38n1dppc1.jpeg,18,2024-03-21 20:34:52,This is first time playing option with profit….. what should I do ???????,0.0,2024-03-21,1
ARM will drop after the bell because,611,1cnaze4,https://www.reddit.com/r/wallstreetbets/comments/1cnaze4/arm_will_drop_after_the_bell_because/,261,2024-05-08 23:29:14,"1. Declining sales for mobile chips - Apple recently announced the decline for iPhones was 10% this quarter. The only reason their stock pumped up was due to their share buy back announced. ARM will not have this luxury and decreasing demand will hurt them
2. Previous guidance was made under the assumption of 3 rate cuts this year. We are down to maybe 1? This had hurt SMCI as well as AMD two chip manufacturers who build chips using ARM's archecture... suffice to say guidance will be poor hurting their stock price against Wall Streets insane expectations for chip manufacturers
3. I have NVDA calls (expiring May 24th) , one of ARM's biggest customers, thus by proxy my calls are gonna tank after close. Honestly debating on buying ARM puts (expiring this Friday) to hedge but IV crush is gonna be a bitch with this one

Edit: I bought calls expiring this Friday so it’s gonna crash. GG friends

Edit 2: I told yall their revenue guidance would miss smh 🤦 ",0.0,2024-05-08,1
Micropp SMCI put gains,35,1asjwee,https://www.reddit.com/gallery/1asjwee,14,2024-02-17 02:47:49,"Smooth brain kept me in bed till an hour after market open otherwise I would’ve paper handsed it earlier 

Rolled it into a couple more puts for next week to chase the dragon 🐉",0.0,2024-02-17,1
$SMCI 3K->11.5K (Worth The Ban),70,1ajrj17,https://www.reddit.com/gallery/1ajrj17,13,2024-02-06 02:34:08,"$SMCI 2/9 665/700 Calls

$AMD robbed my of about $2300 at the start of the session

Pretty sure I’m getting a 90 day ban for pattern day trading but that’s fine. Around a 400% gain in a few hours. I still think this goes higher but realistically a 90 day break is probably the best thing to do. Thank you to Robinhood Daycare for putting me in timeout and forcing me to withdraw my profits. 🙏🏻

… time to move my profits into Think or Swim and lose it all 🥹",0.3,2024-02-06,2
"Finally a green week! CRWD, HPE, and SMCI Calls (All Sold & Cashed Out)",28,1d8qhnt,https://i.redd.it/k3imckwjdr4d1.jpeg,5,2024-06-05 19:23:17,,-0.25,2024-06-05,1
A little weekend exposure $SMCI,10,1ba2mjj,https://www.reddit.com/gallery/1ba2mjj,17,2024-03-09 04:53:00,"Saw the double rejection at the 61.8% retrace from yesterday’s low to todays peak.  Shit that was good enough for me and I decided to pull the trigger on one..  We’ll see how she plays out come Monday!

Hope y’all have a great weekend!",-0.1875,2024-03-09,1
